{
  "schemaVersion": 1,
  "videoId": "RpUTF_U4kiw",
  "title": "Claude Code Multi-Agent Orchestration with Opus 4.6, Tmux and Agent Sandboxes",
  "summary": "This tutorial argues that the new bottleneck in agentic coding is no longer raw model capability but the engineer’s ability to orchestrate agents, shape context, and observe execution. IndyDevDan demonstrates a practical workflow that combines Claude Code’s experimental agent teams, `tmux` panes for live parallel visibility, and cloud-based agent sandboxes to fan out work across multiple full-stack apps, then shows how observability and disciplined team lifecycle management make that parallelism usable instead of chaotic.",
  "takeaways": [
    "Multi-agent orchestration is presented as the real breakthrough, with a primary agent creating teams, assigning tasks, and consolidating results across multiple codebases.",
    "`tmux` is used as a lightweight control surface for orchestration because each spawned sub-agent appears in its own pane with its own context window, session, and model.",
    "Observability is treated as mandatory infrastructure, not a nice-to-have, because the demo tracks high-volume tool activity and lets the operator inspect individual agent behavior.",
    "Agent sandboxes provide isolated execution environments so agents can mount, reboot, and run applications without risking the local machine.",
    "The workflow depends heavily on prompt and context engineering, with information-dense instructions like team creation, skill loading, and sandbox reboot commands driving behavior.",
    "The recommended lifecycle is explicit: create team, create tasks, let agents work in parallel, shut them down, and delete the team to reset context cleanly.",
    "Parallel execution produced useful results quickly, but the demo also shows that some sandboxes still needed iterative follow-up, reinforcing that orchestration accelerates work without removing debugging.",
    "The video frames this as an engineering discipline rather than 'vibe coding', emphasizing reusable systems, transparent tooling, and trust-building with agent workflows."
  ],
  "actionItems": [
    "Enable Claude Code’s experimental agent teams in a controlled environment and verify you can create, assign, and tear down a small agent team end to end.",
    "Use `tmux` as the execution shell for multi-agent sessions so each sub-agent gets its own visible pane and you can inspect progress without losing the primary orchestrator.",
    "Add observability before scaling up parallelism, including hooks or logs that capture session starts, task updates, tool calls, and inter-agent communication.",
    "Move risky or high-churn agent tasks into isolated sandboxes such as `E2B` so agents can install dependencies, reboot apps, and manipulate environments safely.",
    "Adopt a repeatable orchestration prompt pattern that tells the primary agent to create a task list, load required skills, assign specialized work, and summarize outputs.",
    "Treat team shutdown as part of the workflow by deleting agents and resetting context after each job instead of letting long-lived teams accumulate stale state."
  ],
  "notablePoints": [
    "The demo starts with eight one-shotted full-stack applications created by Claude Opus 4.6 and uses them as the workload for orchestration experiments.",
    "A first team is asked to inspect multiple codebases and summarize how to run each one, showing the pattern of specialized agents doing narrow tasks then exiting.",
    "A second phase mounts and rehosts applications in sandbox environments, split across two teams of four agents working in parallel.",
    "The video highlights concrete orchestration tools such as `TeamCreate`, `TeamDelete`, `TaskCreate`, `TaskList`, `TaskGet`, `TaskUpdate`, and `SendMessage`.",
    "The observability system reportedly captured 60+ tool calls within about a minute for one slice of work and more than 160 total calls during the broader demo.",
    "Each agent is described as having its own context window, model, session ID, and identity, which is central to why the parallel workflow scales.",
    "The demo openly shows imperfect outcomes, with six of eight sandbox environments working and two still needing repair, which strengthens the case for observability and iterative follow-up.",
    "The speaker repeatedly grounds the workflow in the 'core four' of context, model, prompt, and tools, arguing that orchestration quality comes from combining all four well."
  ],
  "reportMarkdown": "---\ntitle: \"Claude Code Multi-Agent Orchestration with Opus 4.6, Tmux and Agent Sandboxes\"\nchannel: \"IndyDevDan\"\ntopic: \"ai-llms\"\npublishedDate: \"2026-02-09\"\ngeneratedAt: \"2026-03-13\"\npattern: \"headless-youtube-analysis\"\ncontentType: \"tutorial\"\nanalysisDepth: \"standard\"\nsourceUrl: \"https://youtube.com/watch?v=RpUTF_U4kiw\"\ngithubRepos:\n  - \"https://github.com/disler/agent-sandbox-skill\"\n  - \"https://github.com/disler/claude-code-hooks-multi-agent-observability\"\n  - \"https://github.com/tmux/tmux\"\n---\n\n## Summary\nThe core thesis of the video is that model quality is no longer the main constraint in agentic engineering. IndyDevDan argues that modern models like Opus 4.6 are already strong enough for much more than most teams currently unlock, and that the real differentiator is whether an engineer can orchestrate specialized agents, engineer context well, and build reusable workflows around those capabilities.\n\nThe tutorial centers on a live orchestration demo using Claude Code’s experimental agent teams, `tmux` for pane-based parallel visibility, and isolated agent sandboxes for execution. A primary orchestrator agent creates task lists, spins up teams, assigns narrow jobs to sub-agents, and then consolidates outputs. The operator can watch these agents appear in separate `tmux` panes, each with its own session and context window, while a custom observability layer captures tool calls, session hooks, task updates, and agent communications.\n\nThe second major lesson is that orchestration only becomes trustworthy when paired with visibility and isolation. Observability lets the operator inspect exactly what agents are doing, while sandboxes give agents a safe place to reboot applications, upload code, and install dependencies without jeopardizing the local machine. The result is a workflow that scales compute across multiple apps in parallel while preserving enough control to debug failures and iterate when some tasks inevitably misfire.\n\nThe video closes by framing multi-agent work as an engineering discipline rather than a novelty. The recommended pattern is explicit and repeatable: create a team, create tasks, let specialized agents execute in parallel, collect results, shut the agents down, and delete the team. That lifecycle enforces better context hygiene and makes multi-agent systems more maintainable as workloads grow.\n\n## Key Takeaways\n- **Orchestration over raw model hype**—The speaker deliberately skips benchmark talk to emphasize that the bigger shift is operational: engineers who can coordinate agents will extract more value than those who merely adopt stronger models.\n- **`tmux` as an orchestration console**—Running Claude Code inside `tmux` makes multi-agent work tangible because each sub-agent opens in its own pane, exposing progress, context usage, and session state in real time.\n- **Observability creates trust**—The demo’s hook-based tracing shows session starts, task events, tool usage, and inter-agent activity, making it possible to inspect what happened instead of guessing why a workflow succeeded or failed.\n- **Sandboxes enable safe parallel execution**—Agents mount apps, reboot environments, and run setup flows inside isolated sandboxes rather than directly on the host machine, which reduces risk while increasing scale.\n- **Prompt engineering drives the workflow**—The primary agent responds to information-dense instructions like creating a team, loading sandbox-related skills, and assigning work across directories, showing that orchestration quality depends heavily on precise prompts.\n- **Specialization reduces context pressure**—Each sub-agent handles one bounded task, then exits, allowing the primary agent to preserve context budget while still coordinating work across many codebases.\n- **Lifecycle discipline matters**—The video emphasizes creating teams and deleting them when work is done, which prevents stale context from accumulating and encourages cleaner task boundaries.\n- **Parallelism accelerates but does not guarantee correctness**—Most sandbox rehosts succeed in the demo, but a few apps still miss data and require follow-up teams, illustrating that orchestration improves throughput while preserving the need for debugging loops.\n\n## Action Items\n1. **Enable experimental team support** by exporting the Claude Code flag for agent teams in a safe test setup, then confirm you can create and observe a minimal team session before scaling out.\n2. **Run orchestration inside `tmux`** so each sub-agent receives its own pane, letting you inspect live progress, switch windows quickly, and preserve a visual mental model of parallel work.\n3. **Instrument agent observability** with hooks or logs that capture session starts, task creation, task updates, tool calls, and agent shutdown events before attempting larger multi-agent jobs.\n4. **Move execution into sandboxes** such as `E2B` when agents need to mount applications, reboot services, install dependencies, or manipulate environments repeatedly.\n5. **Standardize your primary-agent prompt pattern** so it always creates a task list, assigns specialized work, gives required skills and context, and summarizes outputs at the end.\n6. **Delete teams after completion** to enforce context reset, reduce drift, and make each multi-agent run reproducible instead of leaving long-lived agents around with stale state.\n\n## Supporting